{
  "$defs": {
    "LeaderboardEvidenceVerificationRef": {
      "additionalProperties": false,
      "properties": {
        "artifact_attestation_github_repository": {
          "default": "",
          "title": "Artifact Attestation Github Repository",
          "type": "string"
        },
        "artifact_attestation_github_sha": {
          "default": "",
          "title": "Artifact Attestation Github Sha",
          "type": "string"
        },
        "artifact_attestation_report_path": {
          "default": "",
          "title": "Artifact Attestation Report Path",
          "type": "string"
        },
        "artifact_attestation_subject_sha256": {
          "default": "",
          "title": "Artifact Attestation Subject Sha256",
          "type": "string"
        },
        "evidence_sha256": {
          "title": "Evidence Sha256",
          "type": "string"
        },
        "github_run_url": {
          "title": "Github Run Url",
          "type": "string"
        },
        "report_path": {
          "title": "Report Path",
          "type": "string"
        },
        "report_schema_version": {
          "enum": [
            "agent-anvil.leaderboard.github_run_verification.v1",
            "agent-anvil.leaderboard.maintainer_rerun.v1"
          ],
          "title": "Report Schema Version",
          "type": "string"
        },
        "submission_path": {
          "title": "Submission Path",
          "type": "string"
        },
        "trust_level": {
          "enum": [
            "github_actions",
            "maintainer_rerun"
          ],
          "title": "Trust Level",
          "type": "string"
        }
      },
      "required": [
        "submission_path",
        "report_path",
        "report_schema_version",
        "trust_level",
        "evidence_sha256",
        "github_run_url"
      ],
      "title": "LeaderboardEvidenceVerificationRef",
      "type": "object"
    },
    "LeaderboardEvidenceVerificationSummary": {
      "additionalProperties": false,
      "properties": {
        "artifact_attestations": {
          "default": 0,
          "title": "Artifact Attestations",
          "type": "integer"
        },
        "github_actions": {
          "title": "Github Actions",
          "type": "integer"
        },
        "maintainer_rerun": {
          "title": "Maintainer Rerun",
          "type": "integer"
        },
        "total_reports": {
          "title": "Total Reports",
          "type": "integer"
        }
      },
      "required": [
        "total_reports",
        "github_actions",
        "maintainer_rerun"
      ],
      "title": "LeaderboardEvidenceVerificationSummary",
      "type": "object"
    }
  },
  "$id": "agent-anvil.leaderboard.evidence_index.v1",
  "$schema": "https://json-schema.org/draft/2020-12/schema",
  "additionalProperties": false,
  "description": "Agent Anvil public leaderboard evidence verification index schema.",
  "properties": {
    "generated_at": {
      "title": "Generated At",
      "type": "string"
    },
    "generated_by": {
      "title": "Generated By",
      "type": "string"
    },
    "reports": {
      "items": {
        "$ref": "#/$defs/LeaderboardEvidenceVerificationRef"
      },
      "title": "Reports",
      "type": "array"
    },
    "reports_dir": {
      "title": "Reports Dir",
      "type": "string"
    },
    "schema_version": {
      "const": "agent-anvil.leaderboard.evidence_index.v1",
      "title": "Schema Version",
      "type": "string"
    },
    "submissions_dir": {
      "title": "Submissions Dir",
      "type": "string"
    },
    "summary": {
      "$ref": "#/$defs/LeaderboardEvidenceVerificationSummary"
    }
  },
  "required": [
    "schema_version",
    "generated_at",
    "generated_by",
    "submissions_dir",
    "reports_dir",
    "summary",
    "reports"
  ],
  "title": "LeaderboardEvidenceVerificationIndex",
  "type": "object",
  "x-agent-anvil-schema-export-version": "anvil.schema.export.v1",
  "x-agent-anvil-schema-version": "agent-anvil.leaderboard.evidence_index.v1"
}
